{
  "$schema": "https://json-schema.org/draft/2020-12/schema",
  "type": "object",
  "required": ["task_id", "status", "files_examined", "findings", "tests_run", "next_action"],
  "properties": {
    "task_id": {"type": "string", "minLength": 1},
    "status": {"enum": ["completed", "blocked", "needs-review"]},
    "files_examined": {"type": "array", "items": {"type": "string"}},
    "findings": {
      "type": "array",
      "items": {
        "type": "object",
        "required": ["path", "issue", "severity"],
        "properties": {
          "path": {"type": "string"},
          "line": {"type": ["integer", "null"], "minimum": 1},
          "issue": {"type": "string", "minLength": 1},
          "severity": {"enum": ["critical", "high", "medium", "low", "info"]}
        },
        "additionalProperties": false
      }
    },
    "tests_run": {"type": "array", "items": {"type": "string"}},
    "next_action": {"type": "string"}
  },
  "additionalProperties": false
}
